{
  "schema_version": "1.0",
  "number": 107,
  "title": "Add test fixture for external service configuration",
  "body": "Adds a new environment fixture used by integration tests.",
  "draft": false,
  "author": {"login": "test-contributor", "type": "User"},
  "labels": ["tests"],
  "files": [
    {
      "path": "tests/fixtures/example.env",
      "status": "added",
      "patch": "+EXAMPLE_SERVICE_TOKEN=example-placeholder-token"
    }
  ]
}
